{
  "$schema": "content.schema.json",
  "_note": "Edit this file to update the site — no HTML needed. Skills, Projects, and Recommendations render from here. You can edit it right in GitHub's web/mobile editor and the live site updates on save. The editor validates against content.schema.json.",
  "skills": [
    {
      "icon": "🛡️",
      "title": "Application Security",
      "subtitle": "Secure-by-design across the SDLC.",
      "tags": ["Threat modeling (STRIDE)", "Secure code review", "OWASP Top 10 / API Top 10", "Vulnerability management", "SARIF"]
    },
    {
      "icon": "🤖",
      "title": "Security Automation & AI",
      "subtitle": "Tooling that scales security operations.",
      "tags": ["Python", "PowerShell", "LLM / Claude", "SAST / DAST / SCA", "CI/CD guardrails", "Prompt-injection defense"]
    },
    {
      "icon": "☁️",
      "title": "Cloud & Identity",
      "subtitle": "Least-privilege, Zero Trust, hybrid identity.",
      "tags": ["Azure", "AWS", "GCP", "Entra ID & Graph", "IAM / OAuth 2.0", "Kubernetes"]
    },
    {
      "icon": "📋",
      "title": "Governance & Compliance",
      "subtitle": "Audit-driven, standards-aligned.",
      "tags": ["NIST", "ISO 27001", "SOC 2", "CIS", "GDPR", "Incident response"]
    }
  ],
  "projects": [
    {
      "tag": "Open source · AppSec",
      "title": "Cullwise",
      "repo": "UNIFOSEC/cullwise",
      "desc": "AI-assisted application-security triage for CI/CD. Ingests scanner findings (Semgrep / SARIF), de-duplicates and clusters them into vulnerability classes, then uses an LLM to adjust severity, flag false positives, and generate remediation — with defenses against prompt injection. Outputs a live interactive dashboard and SARIF for GitHub Code Scanning.",
      "stack": ["Python", "Claude / LLM", "SARIF", "GitHub Actions"],
      "links": [
        {"label": "▸ Open live dashboard", "url": "https://unifosec.github.io/cullwise/"},
        {"label": "▸ Source code", "url": "https://github.com/UNIFOSEC/cullwise"}
      ]
    },
    {
      "tag": "Commercial platform",
      "title": "ADATT — Identity Lifecycle Execution",
      "desc": "A commercial platform that executes secure employee onboarding and offboarding across hybrid Active Directory + Microsoft 365 — the hands-on execution layer for identity lifecycle actions that complements, rather than replaces, your identity management/IGA. On day one it provisions accounts, group memberships, licenses and mailboxes from a template; on exit it disables accounts with full MFA/FIDO2 teardown, session/token revocation, license reclamation, and compliance-grade audit reporting. Built end-to-end with least-privilege OAuth and encrypted, no-credential-storage design.",
      "stack": ["PowerShell", "MS Graph", "Entra ID", "Cloudflare Workers"],
      "links": [
        {"label": "▸ Visit ADATT", "url": "https://adatt.unifosec.com"}
      ]
    },
    {
      "tag": "LegalTech Platform",
      "title": "ePlanHub — Estate Planning",
      "desc": "Estate-planning platform for attorneys and their clients. ePlanHub is the online estate planning platform attorneys use to run the whole matter — guided intake, automated wills, trusts & deeds, document review, e-signature, and remote online notarization — in one secure, lawyer-led workflow.",
      "stack": ["LegalTech", "SaaS", "e-Signature", "Online Notarization"],
      "links": []
    },
    {
      "tag": "Architecture",
      "title": "Identity Lifecycle Governance",
      "desc": "Audit-driven automated onboarding/offboarding for IT-admin and MSP contexts across Active Directory, Entra ID, and Exchange Online — closing orphaned-account and standing-access risks that are a primary lateral-movement vector.",
      "stack": ["IAM", "Multi-tenant", "Audit logging"],
      "links": []
    },
    {
      "tag": "AI",
      "title": "AI Feedback Application",
      "desc": "An AI application that collects and analyzes customer feedback to improve AI-agent behavior — applying AI development coursework to a working prototype.",
      "stack": ["LLM", "Python", "Product"],
      "links": []
    }
  ],
  "recommendations": [
    {
      "quote": "Jose was a critical part of the small and powerful IT/MIS team at ChildNet Inc. During his time there I was grateful to benefit from his expertise. While his role at the time was Management Support Specialist II, he proved his abilities as a system administrator and security professional.\n\nHe designed a clear plan to increase the Windows Server functional domain level from 2003 to 2012. His plan prevented any confusion during the upgrade process. The upgrade happened with no service disruption thanks to his clear plan. Jose also prevented a loss of productivity during a Cisco switch failure. At the time, a core switch failed and brought the main office to a halt. Our network services contractor was unable to respond immediately. Jose then volunteered his skills to login and reconfigure another switch to act as a replacement. The office was back online within an hour.\n\nJose's last major accomplishment I want to highlight is high work with our computer re imaging workflow. Thanks to his research with the Microsoft provided tools, ChildNet was able to reduce our computer setup time from 1 day to less than an hour. This is also improved our inventory from a few desktops and laptops to more than 20 at any time. This was all done with minimal capital expense.\n\nJose accomplished these and many other great projects while still excelling as a Management Support Specialist II who received 30-50 tickets per day.",
      "name": "Marcus Batson",
      "title": "Software Support Engineer, Applied Materials",
      "initials": "MB"
    },
    {
      "quote": "Working with Jose was an honor. In an industry that can be full of egos, Jose never withheld sharing knowledge about IT and how to solve problems efficiently. His hunger for perusing certifications and learning about emerging technologies is contagious and inspiring. Anyone that gets to work with him will be a better admin/engineer.",
      "name": "Noah F.",
      "title": "IT systems Administrator, Miami-Dade County ITD",
      "initials": "NF"
    }
  ]
}
